[{
    "ID": 1,
    "class": "RNA-RNA",
    "type": "basepairing", 
    
    "evidence": [{
            "type": "Direct Duplex Detection", 
            "method": "RANnue", 
            "command": "RNAnue -minfraglen 18 -minlen 36 -sitelenratio 0.3",
            "data": {
                "complementarity": {
                    "unit": "gcs",
                    "value": 0.8
                }
            }
    }],
    "partners": [ 
        {
            "name": "dsrA",
            "symbol": "dsrA", 
            "type": "small_regulatory_ncRNA", 
            "genomic_coordinates": "chr1:+:2025223-2025313",
            "organism_name": "Escherichia coli K-12 MG1655",
            "organism_acc": "NC_000913",
            "local_sites": [ 
                [],[[25,32],[10,17]]
            ]
        },
        {
            "name": "rpoS",
            "symbol": "rpoS",
            "type": "mRNA",
            "genomic_coordinates": "chr1:-:2866559-2867551",
            "organism_name": "Escherichia coli K-12 MG1655",
            "organisms_acc": "NC_000913",
            "local_sites": [ 
                [[70,83],[19,32]],[]
            ]
        }
    ]
}]
